<?xml version="1.0" encoding="UTF-8"?>
<oghamBase xmlns:xsi="http://www.w3.org/2001/XMLSchema-instance"
    xsi:noNamespaceSchemaLocation="oghamSchemaV0_11.xsd">
    <about>
        <title>Ogham Information, Version 0.1</title>
        <author>Benjamin M. Riesenberg</author>
        <description>
            <p> I created this site as a project for the <b>Technical Foundations of Information</b>
                course at the University of Washington iSchool. I had a couple of goals: </p>
            <ol>
                <li>Learn about XML and using XML to organize information and create a
                    publication--in this case a website</li>
                <li>Learn more about the ogham characters and present it in a clear and precise
                    way</li>
            </ol>
            <p> I succeeded in the first task to some extent. Regarding the second task, I do
                present some information here, but let me be clear: </p>
            <p> THE INFORMATION PRESENTED HERE HAS BEEN TAKEN DIRECTLY FROM THE WIKIPEDIA PAGES CITED BELOW, AND POURED INTO THE FORM YOU SEE HERE FOR THE PURPOSE OF LEARNING HOW TO USE XML SCHEMAS, INSTANCES, AND TRANSFORMS. </p>
            <p> I had hoped to spend some time reading The Scholars' Primer--cited below both from
                the Internet Archive and the Hathi Trust--and to present the information about
                characters based on my close reading of this text. I should have known that I'd be
                more than busy enough learning about XML and wouldn't have time for this. I will say
                here that I understand that book to be a significant source on the ogham characters.
                If I understand correctly, it summarizes a lot of what is known about the characters
                based on manuscripts and other sources, and is where much of what I found at
                Wikipedia came from. </p>
        </description>
        <sources>
            <sourceIdRef>oghamWiki</sourceIdRef>
            <sourceIdRef>briatharogamWiki</sourceIdRef>
            <sourceIdRef>oghamWikiCommons</sourceIdRef>
            <sourceIdRef>oghamUnicodeWiki</sourceIdRef>
            <sourceIdRef>auraiceptInternetArchive</sourceIdRef>
            <sourceIdRef>auraiceptHathiTrust</sourceIdRef>
        </sources>
    </about>
    <oghamCharacters>
        <ogham id="_B">
            <letter>B</letter>
            <unicodeCharacter>ᚁ</unicodeCharacter>
            <pronunciation>Beith</pronunciation>
            <pronunciation language="Old Irish">Beithe</pronunciation>
            <meaning meaningType="botanicalTrees">Birch</meaning>
            <series>Aicme Beithe</series>
            <verseBríatharogamMorainnmacMoín><i>Féochos foltchain</i>: "Withered foot with fine
                hair"</verseBríatharogamMorainnmacMoín>
            <verseBríatharogamMaicindÓc><i>Glaisem cnis</i>: "Greyest of
                skin"</verseBríatharogamMaicindÓc>
            <verseBríatharogamConCulainn><i>Maise malach</i>: "Beauty of the
                eyebrow"</verseBríatharogamConCulainn>
            <image imageOrientation="horizontal">Ogham_letter_beith.svg</image>
            <image imageOrientation="vertical">Ogham_vertical_letter_beith.svg</image>
            <unicode>1681</unicode>
            <description>
                <p>So, to be honest, I <i>don't have</i> content that actually needs to be in this
                    description element right now. I can, however, think of a few things that might
                    be good to include if I had them:</p>
                <ul>
                    <li>Some fun facts. But they'd have to be <b>fun</b>.</li>
                    <li>Some other sort of notes or somesuch. Something that <u>isn't included
                            elsewhere</u>.</li>
                    <li>Other stuff I can't think of right now.</li>
                </ul>
                <br/>
                <p>Let me say a little more--I hope that I'll be able to use this kind of rich
                    description element along with it's child elements in the future.</p>
            </description>
            <sources>
                <sourceIdRef>oghamWiki</sourceIdRef>
                <sourceIdRef>briatharogamWiki</sourceIdRef>
                <sourceIdRef>oghamWikiCommons</sourceIdRef>
                <sourceIdRef>oghamUnicodeWiki</sourceIdRef>
            </sources>
        </ogham>
        <ogham id="_L">
            <letter>L</letter>
            <unicodeCharacter>ᚂ</unicodeCharacter>
            <pronunciation>Luis</pronunciation>
            <meaning meaningType="botanicalTrees">Rowan</meaning>
            <series>Aicme Beithe</series>
            <verseBríatharogamMorainnmacMoín><i>Lí súla</i>: "Lustre of the
                eye"</verseBríatharogamMorainnmacMoín>
            <verseBríatharogamMaicindÓc><i>Carae cethrae</i>: "Friend of
                cattle"</verseBríatharogamMaicindÓc>
            <verseBríatharogamConCulainn><i>Lúth cethrae</i>: "Sustenance of
                cattle"</verseBríatharogamConCulainn>
            <image imageOrientation="horizontal">Ogham_letter_luis.svg</image>
            <image imageOrientation="vertical">Ogham_vertical_letter_luis.svg</image>
            <unicode>1682</unicode>
            <sources>
                <sourceIdRef>oghamWiki</sourceIdRef>
                <sourceIdRef>briatharogamWiki</sourceIdRef>
                <sourceIdRef>oghamWikiCommons</sourceIdRef>
                <sourceIdRef>oghamUnicodeWiki</sourceIdRef>
            </sources>
        </ogham>
        <ogham id="_F">
            <letter>F</letter>
            <unicodeCharacter>ᚃ</unicodeCharacter>
            <pronunciation>Fearn</pronunciation>
            <meaning meaningType="botanicalTrees">Alder</meaning>
            <series>Aicme Beithe</series>
            <verseBríatharogamMorainnmacMoín><i>Airenach fían</i>: "Vanguard of
                warriors"</verseBríatharogamMorainnmacMoín>
            <verseBríatharogamMaicindÓc><i>Comét lachta</i>: "Milk
                container"</verseBríatharogamMaicindÓc>
            <verseBríatharogamConCulainn><i>Dín cridi</i>: "Protection of the
                heart"</verseBríatharogamConCulainn>
            <image imageOrientation="horizontal">Ogham_letter_fearn.svg</image>
            <image imageOrientation="vertical">Ogham_vertical_letter_fearn.svg</image>
            <unicode>1683</unicode>
            <sources>
                <sourceIdRef>oghamWiki</sourceIdRef>
                <sourceIdRef>briatharogamWiki</sourceIdRef>
                <sourceIdRef>oghamWikiCommons</sourceIdRef>
                <sourceIdRef>oghamUnicodeWiki</sourceIdRef>
            </sources>
        </ogham>
        <ogham id="_S">
            <letter>S</letter>
            <unicodeCharacter>ᚄ</unicodeCharacter>
            <pronunciation>Sail</pronunciation>
            <meaning meaningType="botanicalTrees">Willow</meaning>
            <series>Aicme Beithe</series>
            <verseBríatharogamMorainnmacMoín><i>Lí ambi</i>: "Pallor of a lifeless
                one"</verseBríatharogamMorainnmacMoín>
            <verseBríatharogamMaicindÓc><i>Lúth bech</i>: "Sustenance of
                bees"</verseBríatharogamMaicindÓc>
            <verseBríatharogamConCulainn><i>Tosach mela</i>: "Beginning of
                honey"</verseBríatharogamConCulainn>
            <image imageOrientation="horizontal">Ogham_letter_sail.svg</image>
            <image imageOrientation="vertical">Ogham_vertical_letter_sail.svg</image>
            <unicode>1684</unicode>
            <sources>
                <sourceIdRef>oghamWiki</sourceIdRef>
                <sourceIdRef>briatharogamWiki</sourceIdRef>
                <sourceIdRef>oghamWikiCommons</sourceIdRef>
                <sourceIdRef>oghamUnicodeWiki</sourceIdRef>
            </sources>
        </ogham>
        <ogham id="_N">
            <letter>N</letter>
            <unicodeCharacter>ᚅ</unicodeCharacter>
            <pronunciation>Nion</pronunciation>
            <pronunciation language="Old Irish">Nin</pronunciation>
            <meaning meaningType="botanicalTrees">Ash</meaning>
            <series>Aicme Beithe</series>
            <verseBríatharogamMorainnmacMoín><i>Costud side</i>: "Establishing of
                peace"</verseBríatharogamMorainnmacMoín>
            <verseBríatharogamMaicindÓc><i>Bág ban</i>: "Boast of
                women"</verseBríatharogamMaicindÓc>
            <verseBríatharogamConCulainn><i>Bág maise</i>: "Boast of
                beauty"</verseBríatharogamConCulainn>
            <image imageOrientation="horizontal">Ogham_letter_nion.svg</image>
            <image imageOrientation="vertical">Ogham_vertical_letter_nion.svg</image>
            <unicode>1685</unicode>
            <sources>
                <sourceIdRef>oghamWiki</sourceIdRef>
                <sourceIdRef>briatharogamWiki</sourceIdRef>
                <sourceIdRef>oghamWikiCommons</sourceIdRef>
                <sourceIdRef>oghamUnicodeWiki</sourceIdRef>
            </sources>
        </ogham>
        <ogham id="_H">
            <letter>H</letter>
            <unicodeCharacter>ᚆ</unicodeCharacter>
            <pronunciation>Uath</pronunciation>
            <pronunciation language="Old Irish">Úath</pronunciation>
            <meaning meaningType="otherAbstractThings">Horror</meaning>
            <meaning meaningType="otherAbstractThings">Fear</meaning>
            <meaning meaningType="botanicalTrees">White-thorn</meaning>
            <series>Aicme hÚatha</series>
            <verseBríatharogamMorainnmacMoín><i>Condál cúan</i>: "Assembly of packs of
                hounds"</verseBríatharogamMorainnmacMoín>
            <verseBríatharogamMaicindÓc><i>Bánad gnúise</i>: "Blanching of
                faces"</verseBríatharogamMaicindÓc>
            <verseBríatharogamConCulainn><i>Ansam aidche</i>: "Most difficult at
                night"</verseBríatharogamConCulainn>